{
  "documentType": "d2p:gate-evaluation",
  "schemaVersion": "1.0.0",
  "gateEvaluationId": "gte_golden-tshirt-r1-size-b-regular-woven-export-1to1",
  "evaluatedAt": "2026-01-02T00:00:00Z",
  "action": "export-1to1",
  "targetRefs": [
    {
      "artifactId": "art_golden-tshirt-fit-profile-regular",
      "revisionId": "rev_golden-tshirt-fit-profile-regular-r1"
    },
    {
      "artifactId": "art_golden-tshirt-garment-measurement-spec",
      "revisionId": "rev_golden-tshirt-garment-measurement-spec-r1"
    },
    {
      "artifactId": "art_golden-tshirt-grading-rule-set",
      "revisionId": "rev_golden-tshirt-grading-rule-set-r1"
    },
    {
      "artifactId": "art_golden-tshirt-pattern",
      "revisionId": "rev_golden-tshirt-pattern-r1"
    },
    {
      "artifactId": "art_golden-tshirt-size-system",
      "revisionId": "rev_golden-tshirt-size-system-r1"
    }
  ],
  "profile": {
    "id": "d2p:print-1to1",
    "version": "1.0.0"
  },
  "reportRefs": [
    {
      "id": "vrp_golden-tshirt-r1-size-b-regular-woven-print-1to1",
      "digest": "sha256:b6b8baf14cfd2ac0886e538fa8690ce08cdde38baa2c07e6b6fd8db75de13c80"
    }
  ],
  "waiverIds": [],
  "decision": "allow",
  "reasonCodes": [],
  "addressedFindings": [],
  "resultDigest": "sha256:8c1579adcf97a4f0ff00759a43d28cdba6b90eb4eaec598686bbba252b370f2d"
}
